portfolio_id,project_id,section_reference,category,section,subsection,cost_related,docu_txt
231,246068,1.1,Property Description,GENERAL PROPERTY DATA - EXECUTIVE SUMMARY TABLE,,False,ADA-designated parking count - Property Data is Three
231,246068,3.1,Property Characteristics,Parcel Configuration,,False,"Acreage is and comprised approximately 4.51 acres., Acreage source is (per the Orange County tax assessor and online research information)"
231,246068,3.2.2,Property Characteristics,Site Improvements,"Vehicular Access, Paving",,"There is an Single-year event Reserve cost item regarding Asphalt overlay for total unit of 25800 SF that have 8 years remaining useful life with total cost of 51600.0 dollars, year 8 costs $51600.0., There is an Single-year event Reserve cost item regarding Asphalt seal coat & striping for total unit of 55000 SF that have 2 years remaining useful life with total cost of 6600.0 dollars, year 2 costs $6600.0, year 7 costs $6600.0, year 12 costs $6600.0."
231,246068,4.3.1,,,,,"There is an Single-year event Reserve cost item regarding Exterior cleaning, painting, sealing for total unit of 23000 SF that have 3 years remaining useful life with total cost of 23000.0 dollars, year 3 costs $23000.0, year 11 costs $23000.0."
231,246068,4.4.1,,,,,"There is an Single-year event Reserve cost item regarding Annual roof maintenance for total unit of 1 LS that have 1 years remaining useful life with total cost of 23500.0 dollars, year 1 costs $2000.0, year 2 costs $2500.0, year 3 costs $3000.0, year 4 costs $4000.0, year 5 costs $5000.0, year 6 costs $500.0, year 7 costs $500.0, year 8 costs $1000.0, year 9 costs $1000.0, year 10 costs $1000.0, year 11 costs $1500.0, year 12 costs $1500.0., There is an Single-year event Reserve cost item regarding Roof replacement for total unit of 1 LS that have 1 years remaining useful life with total cost of 265000.0 dollars, year 1 costs $60000.0, year 2 costs $40000.0, year 5 costs $165000.0."
231,246068,5.2,Mechanical and Electrical Systems,"Heating, Ventilation, and Air Conditioning (HVAC)",,,"There is an Spread Reserve cost item regarding HVAC package unit (RTU), Replace for total unit of 20 TON that have 3 years remaining useful life with total cost of 24000.0 dollars, year 4 costs $4800.0, year 5 costs $4800.0, year 6 costs $4800.0, year 7 costs $4800.0, year 8 costs $4800.0."
