portfolio_id,project_id,section_reference,category,section,subsection,cost_related,docu_txt
231,246040,1.1,Property Description,GENERAL PROPERTY DATA - EXECUTIVE SUMMARY TABLE,,False,ADA-designated parking count - Property Data is Four standard ADA accessible spaces
231,246040,3.1,Property Characteristics,Parcel Configuration,,False,"Acreage is and comprised approximately 19.67 acres., Acreage source is (per the Orange County Property Appraiser tax assessor)"
231,246040,3.2.2,Property Characteristics,Site Improvements,"Vehicular Access, Paving",False,ADA (including van spaces) is four
231,246040,3.2.2,Property Characteristics,Site Improvements,"Vehicular Access, Paving",,"There is an Single-year event Reserve cost item regarding Asphalt seal coat & striping for total unit of 80000 SF that have 5 years remaining useful life with total cost of 9600.0 dollars, year 5 costs $9600.0, year 10 costs $9600.0."
231,246040,4.3.1,,,,,"There is an Single-year event Reserve cost item regarding Exterior cleaning, painting, sealing for total unit of 18500 SF that have 5 years remaining useful life with total cost of 18500.0 dollars, year 5 costs $18500.0."
231,246040,4.4.1,,,,,"There is an Single-year event Reserve cost item regarding Roof replacement for total unit of 4700 SF that have 7 years remaining useful life with total cost of 28200.0 dollars, year 7 costs $28200.0."
231,246040,5.2,Mechanical and Electrical Systems,"Heating, Ventilation, and Air Conditioning (HVAC)",,,"There is an Spread Reserve cost item regarding HVAC package unit (RTU), Replace for total unit of 33 TON that have 10 years remaining useful life with total cost of 39600.0 dollars, year 10 costs $13200.0, year 11 costs $13200.0, year 12 costs $13200.0."
