portfolio_id,project_id,section_reference,category,section,subsection,cost_related,docu_txt
231,246073,1.1,Property Description,GENERAL PROPERTY DATA - EXECUTIVE SUMMARY TABLE,,False,ADA-designated parking count - Property Data is One
231,246073,3.1,Property Characteristics,Parcel Configuration,,False,"Acreage is and comprised approximately 6.21 acres., Acreage source is Tarrant County Appraisal District"
231,246073,3.2.2,Property Characteristics,Site Improvements,"Vehicular Access, Paving",False,"ADA (including van spaces) is including one ADA-designated space,"
231,246073,5.2,Mechanical and Electrical Systems,"Heating, Ventilation, and Air Conditioning (HVAC)",,False,Accessory Area Heating Type is Accessory areas such as mechanical rooms and vestibules were heated by ceiling-hung unit heaters.
231,246073,4.3.1,,,,,"There is an Single-year event Reserve cost item regarding Exterior cleaning, painting, sealing for total unit of 50000 SF that have 8 years remaining useful life with total cost of 50000.0 dollars, year 8 costs $50000.0."
231,246073,5.2,Mechanical and Electrical Systems,"Heating, Ventilation, and Air Conditioning (HVAC)",,,"There is an Spread Reserve cost item regarding Split-system furnace/fan coil, Replace for total unit of 2 EA that have 10 years remaining useful life with total cost of 7000.0 dollars, year 10 costs $3500.0, year 11 costs $3500.0., There is an Spread Reserve cost item regarding Split-system condenser, Replace for total unit of 6 TON that have 5 years remaining useful life with total cost of 7200.0 dollars, year 5 costs $3600.0, year 6 costs $3600.0., There is an Spread Reserve cost item regarding HVAC package unit (RTU), Replace for total unit of 20 TON that have 3 years remaining useful life with total cost of 24000.0 dollars, year 3 costs $6000.0, year 4 costs $6000.0, year 5 costs $6000.0, year 6 costs $6000.0."
